db_name	table_name	column_name	column_type	column_nullable	url	notes	versions
snowflakedb	applicable_roles	grantee	text		https://docs.snowflake.com/en/sql-reference/info-schema/applicable_roles.html	role or user to whom the privilege is granted	
snowflakedb	applicable_roles	role_name	text		https://docs.snowflake.com/en/sql-reference/info-schema/applicable_roles.html	name of the role	
snowflakedb	applicable_roles	role_owner	text		https://docs.snowflake.com/en/sql-reference/info-schema/applicable_roles.html	owner of the role	
snowflakedb	applicable_roles	is_grantable	text		https://docs.snowflake.com/en/sql-reference/info-schema/applicable_roles.html	whether this role can be granted to others	
snowflakedb	columns	table_catalog	text		https://docs.snowflake.com/en/sql-reference/info-schema/columns.html	database that the table belongs to	
snowflakedb	columns	table_schema	text		https://docs.snowflake.com/en/sql-reference/info-schema/columns.html	schema that the table belongs to	
snowflakedb	columns	table_name	text		https://docs.snowflake.com/en/sql-reference/info-schema/columns.html	table or view that the column belongs to	
snowflakedb	columns	column_name	text		https://docs.snowflake.com/en/sql-reference/info-schema/columns.html	name of the column	
snowflakedb	columns	ordinal_position	number		https://docs.snowflake.com/en/sql-reference/info-schema/columns.html	ordinal position of the column in the table	
snowflakedb	columns	column_default	text		https://docs.snowflake.com/en/sql-reference/info-schema/columns.html	default value of the column	
snowflakedb	columns	is_nullable	text		https://docs.snowflake.com/en/sql-reference/info-schema/columns.html	‘yes’ if the column may contain null, ‘no’ otherwise	
snowflakedb	columns	data_type	text		https://docs.snowflake.com/en/sql-reference/info-schema/columns.html	data type of the column	
snowflakedb	columns	character_maximum_length	number		https://docs.snowflake.com/en/sql-reference/info-schema/columns.html	maximum length in characters of string columns	
snowflakedb	columns	character_octet_length	number		https://docs.snowflake.com/en/sql-reference/info-schema/columns.html	maximum length in bytes of string columns	
snowflakedb	columns	numeric_precision	number		https://docs.snowflake.com/en/sql-reference/info-schema/columns.html	numeric precision of numeric columns	
snowflakedb	columns	numeric_precision_radix	number		https://docs.snowflake.com/en/sql-reference/info-schema/columns.html	radix of precision of numeric columns	
snowflakedb	columns	numeric_scale	number		https://docs.snowflake.com/en/sql-reference/info-schema/columns.html	scale of numeric columns	
snowflakedb	columns	datetime_precision	number		https://docs.snowflake.com/en/sql-reference/info-schema/columns.html	not applicable for snowflake.	
snowflakedb	columns	interval_type	text		https://docs.snowflake.com/en/sql-reference/info-schema/columns.html	not applicable for snowflake.	
snowflakedb	columns	interval_precision	number		https://docs.snowflake.com/en/sql-reference/info-schema/columns.html	not applicable for snowflake.	
snowflakedb	columns	character_set_catalog	text		https://docs.snowflake.com/en/sql-reference/info-schema/columns.html	not applicable for snowflake.	
snowflakedb	columns	character_set_schema	text		https://docs.snowflake.com/en/sql-reference/info-schema/columns.html	not applicable for snowflake.	
snowflakedb	columns	character_set_name	text		https://docs.snowflake.com/en/sql-reference/info-schema/columns.html	not applicable for snowflake.	
snowflakedb	columns	collation_catalog	text		https://docs.snowflake.com/en/sql-reference/info-schema/columns.html	not applicable for snowflake.	
snowflakedb	columns	collation_schema	text		https://docs.snowflake.com/en/sql-reference/info-schema/columns.html	not applicable for snowflake.	
snowflakedb	columns	collation_name	text		https://docs.snowflake.com/en/sql-reference/info-schema/columns.html	the collation specification for this column	
snowflakedb	columns	domain_catalog	text		https://docs.snowflake.com/en/sql-reference/info-schema/columns.html	not applicable for snowflake.	
snowflakedb	columns	domain_schema	text		https://docs.snowflake.com/en/sql-reference/info-schema/columns.html	not applicable for snowflake.	
snowflakedb	columns	domain_name	text		https://docs.snowflake.com/en/sql-reference/info-schema/columns.html	not applicable for snowflake.	
snowflakedb	columns	udt_catalog	text		https://docs.snowflake.com/en/sql-reference/info-schema/columns.html	not applicable for snowflake.	
snowflakedb	columns	udt_schema	text		https://docs.snowflake.com/en/sql-reference/info-schema/columns.html	not applicable for snowflake.	
snowflakedb	columns	udt_name	text		https://docs.snowflake.com/en/sql-reference/info-schema/columns.html	not applicable for snowflake.	
snowflakedb	columns	scope_catalog	text		https://docs.snowflake.com/en/sql-reference/info-schema/columns.html	not applicable for snowflake.	
snowflakedb	columns	scope_schema	text		https://docs.snowflake.com/en/sql-reference/info-schema/columns.html	not applicable for snowflake.	
snowflakedb	columns	scope_name	text		https://docs.snowflake.com/en/sql-reference/info-schema/columns.html	not applicable for snowflake.	
snowflakedb	columns	maximum_cardinality	number		https://docs.snowflake.com/en/sql-reference/info-schema/columns.html	not applicable for snowflake.	
snowflakedb	columns	dtd_identifier	text		https://docs.snowflake.com/en/sql-reference/info-schema/columns.html	not applicable for snowflake.	
snowflakedb	columns	is_self_referencing	text		https://docs.snowflake.com/en/sql-reference/info-schema/columns.html	not applicable for snowflake.	
snowflakedb	columns	is_identity	text		https://docs.snowflake.com/en/sql-reference/info-schema/columns.html	whether this column is an identity column	
snowflakedb	columns	identity_generation	text		https://docs.snowflake.com/en/sql-reference/info-schema/columns.html	whether an identity column’s value is always generated or only generated by default.  snowflake only supports by default	
snowflakedb	columns	identity_start	text		https://docs.snowflake.com/en/sql-reference/info-schema/columns.html	the start value from create table ... (columnx ... autoincrement start <#> ...).	
snowflakedb	columns	identity_increment	text		https://docs.snowflake.com/en/sql-reference/info-schema/columns.html	the increment value from create table ... (columnx ... autoincrement increment <#> ...).	
snowflakedb	columns	identity_maximum	text		https://docs.snowflake.com/en/sql-reference/info-schema/columns.html	not applicable for snowflake.	
snowflakedb	columns	identity_minimum	text		https://docs.snowflake.com/en/sql-reference/info-schema/columns.html	not applicable for snowflake.	
snowflakedb	columns	identity_cycle	text		https://docs.snowflake.com/en/sql-reference/info-schema/columns.html	whether the value of an identity column may cycle.  snowflake only supports no cycle.	
snowflakedb	columns	comment	text		https://docs.snowflake.com/en/sql-reference/info-schema/columns.html	comment for this column	
snowflakedb	databases	database_name	text		https://docs.snowflake.com/en/sql-reference/info-schema/databases.html	name of the database	
snowflakedb	databases	database_owner	text		https://docs.snowflake.com/en/sql-reference/info-schema/databases.html	name of the role that owns the schema	
snowflakedb	databases	is_transient	text		https://docs.snowflake.com/en/sql-reference/info-schema/databases.html	whether this is a transient database	
snowflakedb	databases	comment	text		https://docs.snowflake.com/en/sql-reference/info-schema/databases.html	comment for this database	
snowflakedb	databases	created	timestamp_ltz		https://docs.snowflake.com/en/sql-reference/info-schema/databases.html	creation time of the database	
snowflakedb	databases	last_altered	timestamp_ltz		https://docs.snowflake.com/en/sql-reference/info-schema/databases.html	last altered time of the database	
snowflakedb	databases	retention_time	number		https://docs.snowflake.com/en/sql-reference/info-schema/databases.html	number of days that historical data is retained for time travel	
snowflakedb	enabled_roles	role_name	text		https://docs.snowflake.com/en/sql-reference/info-schema/enabled_roles.html	name of the role	
snowflakedb	enabled_roles	role_owner	text		https://docs.snowflake.com/en/sql-reference/info-schema/enabled_roles.html	owner of the role	
snowflakedb	external_tables	table_catalog	text		https://docs.snowflake.com/en/sql-reference/info-schema/external_tables.html	database that the table belongs to	
snowflakedb	external_tables	table_schema	text		https://docs.snowflake.com/en/sql-reference/info-schema/external_tables.html	schema that the table belongs to	
snowflakedb	external_tables	table_name	text		https://docs.snowflake.com/en/sql-reference/info-schema/external_tables.html	name of the table	
snowflakedb	external_tables	table_owner	text		https://docs.snowflake.com/en/sql-reference/info-schema/external_tables.html	name of the role that owns the table	
snowflakedb	external_tables	created	timestamp_ltz		https://docs.snowflake.com/en/sql-reference/info-schema/external_tables.html	creation time of the table	
snowflakedb	external_tables	last_altered	timestamp_ltz		https://docs.snowflake.com/en/sql-reference/info-schema/external_tables.html	last altered time of the table	
snowflakedb	external_tables	auto_clustering_on	boolean		https://docs.snowflake.com/en/sql-reference/info-schema/external_tables.html	whether automatic clustering is enabled for the table	
snowflakedb	external_tables	comment	text		https://docs.snowflake.com/en/sql-reference/info-schema/external_tables.html	comment for this table	
snowflakedb	external_tables	location	text		https://docs.snowflake.com/en/sql-reference/info-schema/external_tables.html	external stage where the files containing data to be read are staged	
snowflakedb	external_tables	file_format_name	text		https://docs.snowflake.com/en/sql-reference/info-schema/external_tables.html	named file format that describes the staged data files to scan when querying the external table	
snowflakedb	external_tables	file_format_type	text		https://docs.snowflake.com/en/sql-reference/info-schema/external_tables.html	format type of the staged data files to scan when querying the external table	
snowflakedb	file formats	file_format_catalog	text		https://docs.snowflake.com/en/sql-reference/info-schema/file_formats.html	database that the file format belongs to	
snowflakedb	file formats	file_format_schema	text		https://docs.snowflake.com/en/sql-reference/info-schema/file_formats.html	schema that the file format belongs to	
snowflakedb	file formats	file_format_name	text		https://docs.snowflake.com/en/sql-reference/info-schema/file_formats.html	name of the file format	
snowflakedb	file formats	file_format_owner	text		https://docs.snowflake.com/en/sql-reference/info-schema/file_formats.html	name of the role that owns the file format	
snowflakedb	file formats	file_format_type	text		https://docs.snowflake.com/en/sql-reference/info-schema/file_formats.html	type of the file format	
snowflakedb	file formats	record_delimiter	text		https://docs.snowflake.com/en/sql-reference/info-schema/file_formats.html	character that separates records	
snowflakedb	file formats	field_delimiter	text		https://docs.snowflake.com/en/sql-reference/info-schema/file_formats.html	character that separates fields	
snowflakedb	file formats	skip_header	number		https://docs.snowflake.com/en/sql-reference/info-schema/file_formats.html	number of lines skipped at the start of the file	
snowflakedb	file formats	date_format	text		https://docs.snowflake.com/en/sql-reference/info-schema/file_formats.html	date format	
snowflakedb	file formats	time_format	text		https://docs.snowflake.com/en/sql-reference/info-schema/file_formats.html	time format	
snowflakedb	file formats	timestamp_format	text		https://docs.snowflake.com/en/sql-reference/info-schema/file_formats.html	timestamp format	
snowflakedb	file formats	binary_format	text		https://docs.snowflake.com/en/sql-reference/info-schema/file_formats.html	binary format	
snowflakedb	file formats	escape	text		https://docs.snowflake.com/en/sql-reference/info-schema/file_formats.html	string used as the escape character for any field values	
snowflakedb	file formats	escape_unenclosed_field	text		https://docs.snowflake.com/en/sql-reference/info-schema/file_formats.html	string used as the escape character for unenclosed field values	
snowflakedb	file formats	trim_space	text		https://docs.snowflake.com/en/sql-reference/info-schema/file_formats.html	whether whitespace is removed from fields	
snowflakedb	file formats	field_optionally_enclosed_by	text		https://docs.snowflake.com/en/sql-reference/info-schema/file_formats.html	character used to enclose strings	
snowflakedb	file formats	null_if	text		https://docs.snowflake.com/en/sql-reference/info-schema/file_formats.html	a list of strings to be replaced by null	
snowflakedb	file formats	compression	text		https://docs.snowflake.com/en/sql-reference/info-schema/file_formats.html	compression method for the data file	
snowflakedb	file formats	error_on_column_count_mismatch	text		https://docs.snowflake.com/en/sql-reference/info-schema/file_formats.html	whether to generate a parsing error if the number of fields in an input file does not match the number of columns in the corresponding table	
snowflakedb	file formats	created	timestamp_ltz		https://docs.snowflake.com/en/sql-reference/info-schema/file_formats.html	creation time of the file format	
snowflakedb	file formats	last_altered	timestamp_ltz		https://docs.snowflake.com/en/sql-reference/info-schema/file_formats.html	last altered time of the file format	
snowflakedb	file formats	comment	text		https://docs.snowflake.com/en/sql-reference/info-schema/file_formats.html	comment for this file format	
snowflakedb	functions	function_catalog	text		https://docs.snowflake.com/en/sql-reference/info-schema/functions.html	database which the function belongs to	
snowflakedb	functions	function_schema	text		https://docs.snowflake.com/en/sql-reference/info-schema/functions.html	schema which the function belongs to	
snowflakedb	functions	function_name	text		https://docs.snowflake.com/en/sql-reference/info-schema/functions.html	name of the function	
snowflakedb	functions	function_owner	text		https://docs.snowflake.com/en/sql-reference/info-schema/functions.html	name of the role that owns the function	
snowflakedb	functions	argument_signature	text		https://docs.snowflake.com/en/sql-reference/info-schema/functions.html	type signature of the function’s arguments	
snowflakedb	functions	data_type	text		https://docs.snowflake.com/en/sql-reference/info-schema/functions.html	return value data type	
snowflakedb	functions	character_maximum_length	number		https://docs.snowflake.com/en/sql-reference/info-schema/functions.html	maximum length in characters of string return value	
snowflakedb	functions	character_octet_length	number		https://docs.snowflake.com/en/sql-reference/info-schema/functions.html	maximum length in bytes of string return value	
snowflakedb	functions	numeric_precision	number		https://docs.snowflake.com/en/sql-reference/info-schema/functions.html	numeric precision of numeric return value	
snowflakedb	functions	numeric_precision_radix	number		https://docs.snowflake.com/en/sql-reference/info-schema/functions.html	radix of precision of numeric return value	
snowflakedb	functions	numeric_scale	number		https://docs.snowflake.com/en/sql-reference/info-schema/functions.html	scale of numeric return value	
snowflakedb	functions	function_language	text		https://docs.snowflake.com/en/sql-reference/info-schema/functions.html	language of the function	
snowflakedb	functions	function_definition	text		https://docs.snowflake.com/en/sql-reference/info-schema/functions.html	function definition	
snowflakedb	functions	volatility	text		https://docs.snowflake.com/en/sql-reference/info-schema/functions.html	whether the function is volatile or immutable	
snowflakedb	functions	is_null_call	text		https://docs.snowflake.com/en/sql-reference/info-schema/functions.html	whether the function is called on null input	
snowflakedb	functions	created	timestamp_ltz		https://docs.snowflake.com/en/sql-reference/info-schema/functions.html	creation time of the function	
snowflakedb	functions	last_altered	timestamp_ltz		https://docs.snowflake.com/en/sql-reference/info-schema/functions.html	last altered time of the function	
snowflakedb	functions	comment	text		https://docs.snowflake.com/en/sql-reference/info-schema/functions.html	comment for this function	
snowflakedb	functions	is_external 1	boolean		https://docs.snowflake.com/en/sql-reference/info-schema/functions.html	true if the function is an external function.	
snowflakedb	functions	api_integration 1	varchar		https://docs.snowflake.com/en/sql-reference/info-schema/functions.html	the name of the api integration object to authenticate the call to the proxy service.	
snowflakedb	functions	context_headers 1	object		https://docs.snowflake.com/en/sql-reference/info-schema/functions.html	the context header information for the external function.	
snowflakedb	functions	max_batch_rows 1	number		https://docs.snowflake.com/en/sql-reference/info-schema/functions.html	the maximum number of rows in each batch sent to the proxy service.	
snowflakedb	functions	compression 1	string		https://docs.snowflake.com/en/sql-reference/info-schema/functions.html	the type of compression.	
snowflakedb	information_schema_catalog_name	catalog_name	text		https://docs.snowflake.com/en/sql-reference/info-schema/information_schema_catalog_name.html	the name of the database in which this information_schema resides.	
snowflakedb	load_history	schema_name	text		https://docs.snowflake.com/en/sql-reference/info-schema/load_history.html	schema of target table	
snowflakedb	load_history	file_name	text		https://docs.snowflake.com/en/sql-reference/info-schema/load_history.html	name of source file	
snowflakedb	load_history	table_name	text		https://docs.snowflake.com/en/sql-reference/info-schema/load_history.html	name of target table	
snowflakedb	load_history	last_load_time	timestamp_ltz		https://docs.snowflake.com/en/sql-reference/info-schema/load_history.html	timestamp of the load record	
snowflakedb	load_history	status	text		https://docs.snowflake.com/en/sql-reference/info-schema/load_history.html	status: loaded, load failed, or partially loaded	
snowflakedb	load_history	row_count	number		https://docs.snowflake.com/en/sql-reference/info-schema/load_history.html	number of rows loaded from the source file	
snowflakedb	load_history	row_parsed	number		https://docs.snowflake.com/en/sql-reference/info-schema/load_history.html	number of rows parsed from the source file	
snowflakedb	load_history	first_error_message	text		https://docs.snowflake.com/en/sql-reference/info-schema/load_history.html	first error of the source file	
snowflakedb	load_history	first_error_line_number	number		https://docs.snowflake.com/en/sql-reference/info-schema/load_history.html	line number of the first error	
snowflakedb	load_history	first_error_character_position	number		https://docs.snowflake.com/en/sql-reference/info-schema/load_history.html	position of the first error character	
snowflakedb	load_history	first_error_col_name	text		https://docs.snowflake.com/en/sql-reference/info-schema/load_history.html	column name of the first error	
snowflakedb	load_history	error_count	number		https://docs.snowflake.com/en/sql-reference/info-schema/load_history.html	number of error rows in the source file	
snowflakedb	load_history	error_limit	number		https://docs.snowflake.com/en/sql-reference/info-schema/load_history.html	if the number of errors reaches this limit, then abort	
snowflakedb	object_privileges	grantor	text		https://docs.snowflake.com/en/sql-reference/info-schema/object_privileges.html	role who granted the privilege	
snowflakedb	object_privileges	grantee	text		https://docs.snowflake.com/en/sql-reference/info-schema/object_privileges.html	role to whom the privilege is granted	
snowflakedb	object_privileges	object_catalog	text		https://docs.snowflake.com/en/sql-reference/info-schema/object_privileges.html	database containing the object on which the privilege is granted	
snowflakedb	object_privileges	object_schema	text		https://docs.snowflake.com/en/sql-reference/info-schema/object_privileges.html	schema containing the object on which the privilege is granted	
snowflakedb	object_privileges	object_name	text		https://docs.snowflake.com/en/sql-reference/info-schema/object_privileges.html	name of the object on which the privilege is granted	
snowflakedb	object_privileges	object_type	text		https://docs.snowflake.com/en/sql-reference/info-schema/object_privileges.html	type of the object on which the privilege is granted	
snowflakedb	object_privileges	privilege_type	text		https://docs.snowflake.com/en/sql-reference/info-schema/object_privileges.html	type of the granted privilege	
snowflakedb	object_privileges	is_grantable	text		https://docs.snowflake.com/en/sql-reference/info-schema/object_privileges.html	whether the privilege was granted with grant option	
snowflakedb	object_privileges	created	timestamp_ltz		https://docs.snowflake.com/en/sql-reference/info-schema/object_privileges.html	creation time of the privilege	
snowflakedb	pipes	pipe_catalog	text		https://docs.snowflake.com/en/sql-reference/info-schema/pipes.html	database that the pipe belongs to	
snowflakedb	pipes	pipe_schema	text		https://docs.snowflake.com/en/sql-reference/info-schema/pipes.html	schema that the pipe belongs to	
snowflakedb	pipes	pipe_name	text		https://docs.snowflake.com/en/sql-reference/info-schema/pipes.html	name of the pipe	
snowflakedb	pipes	pipe_owner	text		https://docs.snowflake.com/en/sql-reference/info-schema/pipes.html	name of the role that owns the pipe	
snowflakedb	pipes	definition	text		https://docs.snowflake.com/en/sql-reference/info-schema/pipes.html	copy statement used to load data from queued files into a snowflake table.	
snowflakedb	pipes	is_autoingest_enabled	text		https://docs.snowflake.com/en/sql-reference/info-schema/pipes.html	whether auto-ingest is enabled for the pipe. represents future functionality.	
snowflakedb	pipes	notification_channel_name	text		https://docs.snowflake.com/en/sql-reference/info-schema/pipes.html	amazon resource name of the amazon sqs queue for the stage named in the definition column. represents future functionality.	
snowflakedb	pipes	created	timestamp_ltz		https://docs.snowflake.com/en/sql-reference/info-schema/pipes.html	creation time of the pipe	
snowflakedb	pipes	last_altered	timestamp_ltz		https://docs.snowflake.com/en/sql-reference/info-schema/pipes.html	last altered time of the pipe	
snowflakedb	pipes	comment	text		https://docs.snowflake.com/en/sql-reference/info-schema/pipes.html	comment for this pipe	
snowflakedb	pipes	pattern	text		https://docs.snowflake.com/en/sql-reference/info-schema/pipes.html	pattern copy option value in the copy into <table> statement in the pipe definition, if the copy option was specified.	
snowflakedb	procedures	procedure_catalog	text		https://docs.snowflake.com/en/sql-reference/info-schema/procedures.html	database which the stored procedure belongs to	
snowflakedb	procedures	procedure_schema	text		https://docs.snowflake.com/en/sql-reference/info-schema/procedures.html	schema which the stored procedure belongs to	
snowflakedb	procedures	procedure_name	text		https://docs.snowflake.com/en/sql-reference/info-schema/procedures.html	name of the stored procedure	
snowflakedb	procedures	procedure_owner	text		https://docs.snowflake.com/en/sql-reference/info-schema/procedures.html	name of the role that owns the stored procedure	
snowflakedb	procedures	argument_signature	text		https://docs.snowflake.com/en/sql-reference/info-schema/procedures.html	type signature of the stored procedure’s arguments	
snowflakedb	procedures	data_type	text		https://docs.snowflake.com/en/sql-reference/info-schema/procedures.html	return value data type	
snowflakedb	procedures	character_maximum_length	number		https://docs.snowflake.com/en/sql-reference/info-schema/procedures.html	maximum length in characters of string return value	
snowflakedb	procedures	character_octet_length	number		https://docs.snowflake.com/en/sql-reference/info-schema/procedures.html	maximum length in bytes of string return value	
snowflakedb	procedures	numeric_precision	number		https://docs.snowflake.com/en/sql-reference/info-schema/procedures.html	numeric precision of numeric return value	
snowflakedb	procedures	numeric_precision_radix	number		https://docs.snowflake.com/en/sql-reference/info-schema/procedures.html	radix of precision of numeric return value	
snowflakedb	procedures	numeric_scale	number		https://docs.snowflake.com/en/sql-reference/info-schema/procedures.html	scale of numeric return value	
snowflakedb	procedures	procedure_language	text		https://docs.snowflake.com/en/sql-reference/info-schema/procedures.html	language of the stored procedure	
snowflakedb	procedures	procedure_definition	text		https://docs.snowflake.com/en/sql-reference/info-schema/procedures.html	stored procedure definition	
snowflakedb	procedures	created	timestamp_ltz		https://docs.snowflake.com/en/sql-reference/info-schema/procedures.html	creation time of the stored procedure	
snowflakedb	procedures	last_altered	timestamp_ltz		https://docs.snowflake.com/en/sql-reference/info-schema/procedures.html	last altered time of the stored procedure	
snowflakedb	procedures	comment	text		https://docs.snowflake.com/en/sql-reference/info-schema/procedures.html	comment for this stored procedure	
snowflakedb	referential_constraints	constraint_catalog	text		https://docs.snowflake.com/en/sql-reference/info-schema/referential_constraints.html	database that the constraint belongs to	
snowflakedb	referential_constraints	constraint_schema	text		https://docs.snowflake.com/en/sql-reference/info-schema/referential_constraints.html	schema that the constraint belongs to	
